"Titles","Abstracts","Sector"
"[PDF][PDF] The Impact of Technology on Contemporary Accounting: An ABCD Perspective","… and calculators have been used to assist in carrying out accounting activities for centuries … costs
in terms of their negative effects on a firm's brand image and legal liability … although not sufficient,
requirement for artificial intelligence/machine learning, blockchain, and data analytics … 
","Legal and accounting activities"
"Business intelligence & analytics in management accounting research: Status and future focus","… that although “there is potential for studying business intelligence solutions in … is linked to other
emerging technologies such as big data, machine learning and the Internet … Judgment and
decision-making”, “Databases”, and “Expert systems, artificial intelligence and decision-aids … 
","Legal and accounting activities"
"[PDF][PDF] Is India Digitally Prepared for International Trade?","… Data intelligence manifests itself in designing digital technologies like AI, robots, 3D printing,and … and Analytics Spending Guide, published by IDC, the Asia Pacific big data market will … In 2017,
the Association for the Advancement of Artificial Intelligence indicated a 13% growth … 
","Legal and accounting activities"
"[PDF][PDF] Bankruptcy risk prediction models based on artificial neural networks","… As part of the Artificial Intelligence, the neural networks are systems that use approximation
methods based … 31 December 2015 in Romania there were a number of 773781 active legal
entities … 978-0-9742114-1-1. Walczak, S.(2001)“An empirical analysis of data requirements for … 
","Legal and accounting activities"
"Influence of Artificial Intelligence on Activities and Competitiveness of an Organization","… view and edit this information), but also about the compliance with legal regulations (eg … Within
this group 85% of managers believe in the potential of artificial intelligence, 25% implement it …
The category of solutions integrating data from various sources (eg Twillio) and platforms … 
","Legal and accounting activities"
"Zero-Quartile Benchmarking “How To Prioritize Digital Technologies In A Companys™ Transformation Journey","… Cognitive capabilities are used by applying artificial intelligence (AI) such as machine learningor natural language … It should help to handle the growing amount of data (Agarwal and Dhar 2014)and goes beyond traditional – descriptive – business intelligence (BI), because … 
","Legal and accounting activities"
"Toward blockchain-based accounting and assurance","… of an ecosystem of emerging technologies that includes artificial intelligence, the Internet of … rules
encoded could effectively control the recording of accounting activities and, therefore, provide …intelligence to the accounting process by integrating Big Data and predictive analysis … 
","Legal and accounting activities"
"ICT Use, Investments in R&D and Workers' Training, Firms' Productivity and Markups: The Case of Ecuadorian Manufacturing","… that characterize firms from the point of view of locations (24 provinces), industries (12) and legal
forms (8 … network or business group, very likely due to the required software and hardware foraccounting activities and the more … 5 See the “Data” section above and Appendix 1 or 2 … 
","Legal and accounting activities"
"PROGRESSING TECHNOLOGY AND THE OBSOLESCENCE OF ACCOUNTANTS.","… According to the data, the number of tax returns professionally prepared has been … the prevalence
of technology that business owners and accountants use in daily accounting activities … Ms. Philipp's
research interest involves legal issues and regulatory compliance and their … 
","Legal and accounting activities"
"Big data in accounting","… Ernst &Young Limited (EY) is the third case study. Its scope of accounting activities includes:
advisory, assurance and tax services and as a result it demonstrates great scientific interest … BigData can be very … visual data analytics (Gepp et. al, 2018). Another suggestion is “meta … 
","Legal and accounting activities"
"… Criterion of Focus on the Students Benefiting in the Relationship between Adopting the Criterion of Partnership and Resources and Achieving Community Satisfaction …","… the environment, increasing local employment, enhancing value added, meeting legal and
regulatory requirements … This requires listening to and learning from students and beneficiaries,
establishing constructive relationships to … The questionnaire was used to collect data … 
","Legal and accounting activities"
"The International Conference'Education and Creativity for a Knowledge-Based Society'-Economic Sciences-XIth Edition","… is an aspect of economic life that reduces the population of a country or region due … In this study,
we aim to exemplify this phenomenon, which manifests itself more and more acutely … The data
provided by official statistics shows some alarming figures regarding this phenomenon … 
","Legal and accounting activities"
"Bits and bolts","… Real estate 68 Low Low Legal and accounting activities, etc … online renting of data or computing
capacities), as well as back and front office integration systems such as customer relationship
management (CRM), and enterprise resource planning (ERP) software. Page 14 … 
","Legal and accounting activities"
"[BOOK][B] The Routledge Companion to Accounting Information Systems","… interests include continuous auditing and monitoring, audit data analytics and artificial intelligence
in auditing … process management for AIS in the context of new legal requirements for … constituting
different decision-making environments and what they call data environments … 
","Legal and accounting activities"
"Semantic Technologies for Business Decision Support","… processed and incorporated into the company structure, with the support of linguistic rules on
the intelligence phase … development, as it takes advantage of other disciplines as MachineLearning, Artificial Intelligence and Cognitive Science … It relies on data stored in a database … 
","Legal and accounting activities"
"[PDF][PDF] Attitude, Skills and Task Performance of Accountants in the Public Sector","… the first position since 2015 because of technology advancement and big data analytics … to perform
their duties in accordance with institutional, ethical, legal and regulatory framework … on the
increasing demand for accountants to conduct forensic accounting activities and on the … 
","Legal and accounting activities"
"[BOOK][B] Value Creation in Management Accounting and Strategic Management: An Integrated Approach","… 116 7.2.2. Data analysis … in a context of digital transformation that reshapes value chains, business
models and more broadly business practices including accounting activities … JEN 76] explains
that the firm can be defined as a nexus of contracts, and therefore a legal fiction and … 
","Legal and accounting activities"
"What role for social sciences in innovation?","… related fields (including computer science, information systems, software engineering and artificialintelligence) are found … Availability of comprehensive, long-term and internationally comparabledata allows for … cite NPL; citations are frequently given by examiners or by patent … 
","Legal and accounting activities"
"Tech human resources: a study on the impact of digital technologies on international HR startups","… The role of technology is spreading in all processes which composed Human Resource function:
form Recruiting to Learning and … resource tech industry are Social, Mobile, Artificial Intelligence,Big Data and Analytics and Cloud … oriented or effectiveness oriented … 
","Legal and accounting activities"
"Adapting business framework conditions to deal with disruptive technologies in Denmark","… Participation in life-long learning is high but decreasing … Second, the ability to combine new
advanced technologies (such as sensors, advanced robotics and 3D printing), new processes
(such as data-driven production and artificial intelligence) and new business models … 
","Legal and accounting activities"
"Business dynamics and digitalisation","… sectors: Computer and electronics; Machinery and equipment nec; Transport equipment;
Telecommunication; IT; Legal and accounting; Scientific … Data for some countries are still
preliminary … that – on average – in all countries digital intensive sectors exhibit higher or similar … 
","Legal and accounting activities"
"The compositional nature of productivity and innovation slowdown","… Indeed, our task is to understand if the 'data generating process' behind the productivity slowdown …
the so–called within, between, and covariance (or cross–level) components (or effects … the following:
at the firm level, the within effect is interpreted as learning/innovation (change … 
","Legal and accounting activities"
"[PDF][PDF] High Performance Computing Facility Operational Assessment 2016-Oak Ridge Leadership Computing Facility","… Neither the United States Government nor any agency thereof, nor any of their
employees, makes any warranty, express or implied, or assumes any legal liabilityor responsibility for the … 59 4.1.1 Big Data Analytics: Deep Learning … 
","Legal and accounting activities"
"Three essays on audit technology: audit 4.0, blockchain, and audit app","… manufacturing, marketing, and all other business functions such as accounting, legal, human
resources, etc … 1.3. Big Data and Audit Data Analytics In recent years, “big data” has received
increasing attention from accounting … and inaccurately sorted data … 
","Legal and accounting activities"
"[BOOK][B] Society 5.0: Industry of the Future, Technologies, Methods and Tools","… 87 5.9.4. Artificial intelligence … 245 12.9. The notion of data visualization … 3
Translation of French quote. Paul Valéry in “Le bilan de l'intelligence”, extracted from a
conference delivered in 1935, published by Allia Editions in 2011. Page 22 … 
","Legal and accounting activities"
"[PDF][PDF] OPTIMAL SIZING AND SITING OF RENEWABLE DISTRIBUTED GENERATION IN DISTRIBUTION SYSTEMS","… of Discrete Wavelet Transform (DWT) as a feature extraction and Extreme Learning Machine
(ELM) approach … The DWT also gives a fixed amount of data that can be utilized modesty … ELM
can satisfy any continuous or piecewise target function like speech signal with universal … 
","Legal and accounting activities"
"Measuring Performance of Adaptive Supply Chains","… The data source for such a system is the reporting of individual units under accounting activities …
does not solely result from the will to satisfy specific customer requirements, but also the necessity
to adjust products to the legal requirements of … 5.2 Sample and Data Collection … 
","Legal and accounting activities"
"[BOOK][B] Decentralized Computing Using Blockchain Technologies and Smart Contracts: Emerging Research and Opportunities: Emerging Research and …","… With the advent of intelligent systems and self-learning machines, every device require freedom
of … chain, which is computationally very expensive and this makes the blockchain an “immutabledata store … can be either an individual or a group of miners or a machine powered with … 
","Legal and accounting activities"
"The impact of new technologies on the labour market and the social economy","… for employment from new information and communication technologies, including machinelearning, digitalisation in … sector including water and air transport, but, more important, legal andaccounting activities; activities of … the same for the two figures, since firm-level data do not … 
","Legal and accounting activities"
"An entrepreneur's external social capital, innovation capability, and fundamental resources in their startup community: An analysis of Finnish startups in the knowledge …","… 45 4.5.. DATA ANALYSIS 46 5. MODEL ASSESSMENT AND RESULTS 48 … Other financings Equity
financing personal savings, friends and family members, bootstrapping short-term, intermediate,
long-term loans from commercial banks or private individuals and companies … 
","Legal and accounting activities"
"Software robot-based automation of financial administration's processes","… Task type Support for human labourers Most advanced method Configuration (set rules/learning)
Analysing numbers Business Intelligence, data visualisation … The artificial intelligence is defined
as intelligent behaviour of machines (Ertel 2011, 1; Hutter & Legg 2007, 405) … 
","Legal and accounting activities"
"Automated accounting in accounting firms: A qualitative study on impacts and attitudes","… companies increased and became a necessity in order to improve accounting activities and to
store … In accounting, big data can help the bookkeeping by eg analyzing the invoice, find … of whetheror not the profession is dying and if computers and artificial intelligence will take … 
","Legal and accounting activities"
"Publicising food: big data, precision agriculture, and co-experimental techniques of addition","… interviews, involving 18 Iowa farmers, 14 individuals from big data industry (those involved in
the sale and promotion of large-scale data acquisition, predictive analytic software, and/or
precision agriculture technologies), and 19 interviews of regional food system entrepreneurs … 
","Accomodation and food service activities"
"Big data in food safety: An overview","… A list of the most used analysis methods for big data is shown in Table 3. These meth … These
systems are developed using data mining techniques (collaborative filtering, content based filtering
and hybrid … To the author's knowledge, these systems are not yet applied in food safety … 
","Accomodation and food service activities"
"[HTML][HTML] Managing food security through food waste and loss: Small data to big data","This paper provides a management perspective of organisational factors that contributes to the reduction of food waste through the application of design science principles to explore causal relationships between food distribution (organisational) and consumption (societal) …","Accomodation and food service activities"
"Facilitating knowledge management through filtered big data: SME competitiveness in an agri-food sector","… knowledge management (KM) process that utilises filtered big data within an agri-food supply
chain … The specific big data consumer analytics examined is those of the “Tesco Clubcard data”,
otherwise … 17 million customers), with 10 per cent of this customer data being processed … 
","Accomodation and food service activities"
"Consumer research with big data: applications from the food demand survey (FooDS)","… Results show that elasticities of demand for food at home and food away from home … millions of
observations arising from online search and shopping behaviors, retail scanner data, and panel …
A number of recent studies have begun to explore “big data” in relation to modeling … 
","Accomodation and food service activities"
"Alternative data mining/machine learning methods for the analytical evaluation of food quality and authenticity–A review","In recent years, the variety and volume of data acquired by modern analytical instruments in order to conduct a better authentication of food has dramatically increased. Several pattern recognition tools have been developed to deal with the large volume and complexity of …","Accomodation and food service activities"
"A big data and cloud computing specification, standards and architecture: agricultural and food informatics","… data and cloud computing specification, standards and architecture: agricultural and food
informatics … The real-time data storage and management architecture plays important role. This
paper introduces big data, includes the background and definitions, characteristics, related … 
","Accomodation and food service activities"
"Matching restaurant menus to crowdsourced food data: A scalable machine learning approach","We study the problem of how to match a formally structured restaurant menu item to a large database of less structured food items that has been collected via crowd-sourcing. At first glance, this problem scenario looks like a typical text matching problem that might possibly …","Accomodation and food service activities"
"[HTML][HTML] Convergent innovation in food through big data and artificial intelligence for societal-scale inclusive growth","… in Biotechnology is from IMS Engineering College, India, where she took various courses in
molecular biology, genetic engineering, bioprocess engineering, fermentation biotechnology,food biotechnology, and … Using Artificial Intelligence and Web Media Data to Evaluate … 
","Accomodation and food service activities"
"Big Data and the transformation of food and beverage marketing: undermining efforts to reduce obesity?","… of digital marketing, harnessing the power of Big Data analytics, artificial intelligence, and powerful …
rich views of behavioral patterns that can be highly valuable to food and beverage … For example,
leading data company Neustar can identify people who display the following … 
","Accomodation and food service activities"
"Satellite data and machine learning for weather risk management and food security","The increase in frequency and severity of extreme weather events poses challenges for the agricultural sector in developing economies and for food security globally. In this article, we demonstrate how machine learning can be used to mine satellite data and identify pixel …","Accomodation and food service activities"
"Big data and food retail: Nudging out citizens by creating dependent consumers","… a critical look at how food retail firms are using big data, including predictive analytics, ArtificialIntelligence, and the … challenges faced by stores attempting to win over new customers when they
lack the data to deliver … A few weeks back I got some for dog food and infant formula … 
","Accomodation and food service activities"
"A semantic network analysis of big data regarding food exhibition at convention center","… The purpose of this study was to visualize the semantic network with big data related to food
exhibition at convention center. For this, this study collected data containing 'coex food
exhibition/bexco food exhibition' keywords from web pages and news on Google during one … 
","Accomodation and food service activities"
"A geo-big data approach to intra-urban food deserts: Transit-varying accessibility, social inequalities, and implications for urban planning","… Taking advantage of a geo-big data approach and multilevel regression model, we make a
contribution to current literature by … should offer deeper spatial insights into intra-urban foodscape
and provide more nuanced understanding of food deserts … 2. Methodology and data. 2.1 … 
","Accomodation and food service activities"
"Nutritional Culturomics and Big Data: Macroscopic Patterns of Change in Food, Nutrition and Diet Choices","… and diet, their knowledge, awareness and understanding of the interdepend- ence of food
consumption, health … [15]), and mathematical tools to handle complex data sets (eg … application
of Artificial Intelligence for large-scale content analysis [18, 19] or random fractal theory to … 
","Accomodation and food service activities"
"A study on decision-making of food supply chain based on big data","… In order to select an appropriate sample data from the big data in the food supply chain, the
company … These factors mainly include food attributes and the chemical and physical properties
of the product related to these … The second step is to pre-processing the sample data … 
","Accomodation and food service activities"
"An exploratory study on the semantic network analysis of food tourism through the big data","… The purpose of this study was to explore awareness of food tourism using big data analysis. For
this, this study collected data containing 'food tourism' keywords from google web search, google
news, and google scholar during one year from January 1 to December 31, 2016 … 
","Accomodation and food service activities"
"Fallow-land Algorithm based on Neighborhood and Temporal Anomalies (FANTA) to map planted versus fallowed croplands using MODIS data to assist in drought …","An important metric to monitor for optimizing water use in agricultural areas is the amount of cropland left fallowed, or unplanted. Fallowed croplands are difficult to model because they have many expressions; for example, they can be managed and remain free of vegetation or …","Accomodation and food service activities"
"Research and application of big data-based co-regulation model in food safety governance.","This paper is aimed to construct a food safety and nutrition information collection and analysis
platform with new internet technologies including big data to improve the analytic capacity and
the data-mining capability, and thereby to provide more accurate and comprehensive food … 
","Accomodation and food service activities"
"Analysis of the Comparison between Exercise and Food Interventions on Metabolic Syndrome Risk Factors Utilizing Big Data","… Data Ok-Kyeong Yu*, Chan-Yong Jin** and Soo-Tai Nam** *Obesity Research Center (AgrobioFood R & D … & Creativity), Wonkwang University, 54538, Korea E-mail: jcy85366,
stnam(G)wku.ac.kr Abstract Big data analytics examines large amounts of data to uncover … 
","Accomodation and food service activities"
"Big Data Meets the Food Supply: A Network of Cattle Monitoring Systems","… Big data Internet of Things Network sensors Cattle monitoring. Download conference paper PDF …
similar networks could be developed for other types of animals in the human food chain, such
as … Location data of each animal can be used in separate analyses, but the location of … 
","Accomodation and food service activities"
"Combining open data and machine learning to predict food security in Ethiopia","Food security is commonly measured by means of surveys, requiring substantial time and budget. Open data can possibly serve as a cost-effective alternative to predict food security. In this paper a method is proposed that uses open data related to food insecurity drivers to …","Accomodation and food service activities"
"Application of big data in food safety supervision in the United States and its enlightenment to China.","The application of big data plays a crucial role in establishing a food safety system based on
prevention. With the development of the internet and information technology, Chinese government
has paid more and more attention to the application of big data in food safety supervision … 
","Accomodation and food service activities"
"Enhancing Cloud and Big Data Systems for healthy Food and Information Systems Practice: A Conceptual Study","… The Big Data in Food indirectly required for determination of the best design treatments including
resources based on food, nutrition and health and related medical data … Health, Food Informatics
with Big Data—The Health Data Science has a lot of things for the … 
","Accomodation and food service activities"
"[PDF][PDF] Enhancing Cloud and Big Data Systems for healthy Food and Nutrition Information Systems Practice: A Conceptual Study","… Health, Food Informatics with Big Data—The Health Data Science has a lot of things for the partial
development of Food Informatics and Food Information Systems and which include— • Big Data
knowledge in respect of Health is accountable picking knowledge of several kinds … 
","Accomodation and food service activities"
"A Big Data Decision-making Mechanism for Food Supply Chain","… In order to select an appropriate sample data from the big data in the food supply chain, the
company … These factors mainly include food attributes and the chemical and physical properties
of the product related to these … The second step is to pre-processing the sample data … 
","Accomodation and food service activities"
"Automation of Data Collection Techniques for Recording Food Intake: a Review of Publicly Available and Well-Adopted Diet Apps","There has been a proliferation in the development of diet-related smartphone applications (mHealth) that support diet monitoring and can provide health-beneficial interventions. With these developments, the collection of accurate dietary consumption data is becoming an …","Accomodation and food service activities"
"[PDF][PDF] Can business generated big food data be used to understand food consumption behaviour and can a research infrastructure be generated around such data …","… platforms, (b) stakeholders along the food chain, and (c) policy actors in the agricultural-food
and nutrition-health … behaviour can be extracted from existing business generated data and on
which conditions these data might feed into a future RICHFIELDS big data platform … 
","Accomodation and food service activities"
