"Titles","Abstracts","Sector"
"[CITATION][C] Machine learning for public administration research with applications to organizational reputation","Exploring a new model of public administration in a digital age: automation, digitization and transparency","Public administration and defence, compulsory social security"
"This paper describes a model of digital governance that reproduces within the system essential features of public administration while establishing logic for their utilization. The ultimate goal is to be able to confine all participants to their respective roles and …","Administration by Algorithm? Public Management Meets Public Sector Machine Learning","Public administration and defence, compulsory social security"
"Public bodies and agencies increasingly seek to use new forms of data analysis in order to provide'better public services'. These reforms have consisted of digital service transformations generally aimed at'improving the experience of the citizen','making …","Künstliche Intelligenz in der öffentlichen Verwaltung [Artificial Intelligence in Public Administration]","Public administration and defence, compulsory social security"
"Dieser Beitrag gibt einen Überblick über künstliche Intelligenz in der öffentlichen Verwaltung und zeigt auf, welche Handlungsbedarfe zur guten Gestaltung von künstlicher Intelligenz aus der wissenschaftlichen Diskussion abgeleitet werden können. Er widmet sich …","[CITATION][C] Artificial Intelligence, Robotics and Public Administration Models","Public administration and defence, compulsory social security"
"… -Beitrag Zum Handbuch Digitalisierung in Staat Und Verwaltung (Artificial Intelligence-A Contribution to the Handbook Digitisation in State and Public Administration)","Künstliche Intelligenz bezeichnet eine Forschungsfrage, die auf die selbstständige Lösung von Problemen durch technische Systeme abzielt. Ein Forschungszweig der Informatik setzt sich schwerpunktmäßig mit dieser Frage auseinander und hat im Laufe der Zeit …","Public administration and defence, compulsory social security"
"Security-aware resource allocation for mobile social big data: A matching-coalitional game solution","As both the scale of mobile networks and the population of mobile users keep increasing, the applications of mobile social big data have emerged where mobile social users can use their mobile devices to exchange and share contents with each other. The security resource …","Public administration and defence, compulsory social security"
"Machine Learning-Based Models for Big Data Analysis and Prediction: Social Security Applications","The core technology of the Fourth Industrial Revolution is artificial intelligence and big data, and the continuous enhancement of algorithm performance through Machine Learning based on large scale accumulated data is an mportant source technology in all fields …","Public administration and defence, compulsory social security"
"Recent advances in security and privacy in Social Big Data","Social Networks and Big Data have pervaded all aspects of our daily lives. With their unparalleled popularity, Social Networks have evolved from the platforms for social communication and news dissemination, to indispensable tools for professional networking …","Public administration and defence, compulsory social security"
"Security and privacy of big data for social networking services in cloud","Big Data (BD) is of great importance especially in wireless telecommunications field. Social Networking (SNg) is one more fast-growing technology that allows users to build their profile and could be described as web applications. Both of them face privacy and security issues …","Public administration and defence, compulsory social security"
"[BOOK][B] The Five Technological Forces Disrupting Security: How Cloud, Social, Mobile, Big Data and IoT are Transforming Physical Security in the Digital Age","The Five Technological Forces Disrupting Security: How Cloud, Social, Mobile, Big Data and IoT are Transforming Physical Security in the Digital Age explores the major technological forces currently driving digital disruption in the security industry, and what they foretell for the …","Public administration and defence, compulsory social security"
"Personnel security system of nuclear power plants using machine learning for psychological, behavioral and social media activity analysis.","In this research, a novel Personnel Security Model is designed and demonstrated for detecting suspicious people in an organization especially for nuclear power plants. The proposed system composed of three subsystems and a final decision making system such …","Public administration and defence, compulsory social security"
"[BOOK][B] Social Network Forensics, Cyber Security, and Machine Learning","ISSN 2191-530X ISSN 2191-5318 (electronic) SpringerBriefs in Applied Sciences and Technology ISSN 2196-8845 ISSN 2196-8853 (electronic) SpringerBriefs in Forensic and Medical Bioinformatics ISBN 978-981-13-1455-1 ISBN 978-981-13-1456-8 (eBook) …","Public administration and defence, compulsory social security"
"Security and privacy protection of social networks in big data era","Big Data draws the attention not only because of its great power but for the severe security and privacy challenges it brings. With the sources from various formats of user generated contents like digital video, blogging, forms, online social conversations, and so on, Big Data  …","Public administration and defence, compulsory social security"
"[PDF][PDF] 90. Exploration and Development of Public Service of Human Resources and Social Security Based on Big Data","In the exploration of public service system in China, human resources protection and social security are important parts of China's security system. With the development of science and technology, all fields have begun to change due to the huge data resources with the arrival …","Public administration and defence, compulsory social security"
"Social Public Security Management in Intelligent City Based on Fast Big Data Analysis","Social public security management is an important component in the current construction of intelligent cities in China. There have been scale construction of information system for social public security management, which has been widely applied, generating abundant …","Public administration and defence, compulsory social security"
"Bridging machine learning and cryptography in defence against adversarial attacks","In the last decade, deep learning algorithms have become very popular thanks to the achieved performance in many machine learning and computer vision tasks. However, most of the deep learning architectures are vulnerable to so called adversarial examples. This …","Public administration and defence, compulsory social security"
"Machine Learning and Data Mining for IPv6 Network Defence","In future battles, the warfighter will of necessity require more and more networked devices to perform a broad range of tasks. It has been predicted that by the year 2020, there will be 20 billion Internet-of-Things (IoT) devices (and more than 6.2 billion today)(N. Dragoni, 2017) …","Public administration and defence, compulsory social security"
"Myths of automation and their implications for military procurement","Several mythical beliefs surround military automation, including the belief that automation reduces manpower needs, that it requires less training for operators, and that it reduces errors. The unbridled enthusiasm for automation exhibited by some technologists–and …","Public administration and defence, compulsory social security"
"Artificial Intelligence Military Robots","Robots have been around for some time now, and artificial intelligence (AI) is sweeping the world. Combining these technologies to make artificial intelligence robots, that are capable of interaction with humans, is where research and development is headed. Once fully …","Public administration and defence, compulsory social security"
"Identifying probable post-traumatic stress disorder: applying supervised machine learning to data from a UK military cohort","Background: Early identification of probable post-traumatic stress disorder (PTSD) can lead to early intervention and treatment. Aims: This study aimed to evaluate supervised machine learning (ML) classifiers for the identification of probable PTSD in those who are serving, or …","Public administration and defence, compulsory social security"
"… the domain of technology impact user trust? Investigating trust in automation across different consumer-oriented domains in young adults, military, and older adults","Trust has been shown to be a determinant of automation usage and reliance. Thus, understanding the factors that affect trust in automation has been a focus of much research. Despite the increased appearance of automation in consumer-oriented domains, the …","Public administration and defence, compulsory social security"
"Earthmoving Construction Automation with Military Applications: Past, Present and Future","Amongst increasing innovations in frontier engineering sciences, the advancements in Robotic and Autonomous Systems (RAS) has brought about a new horizon in construction applications. There is evidence of the increasing interest in RAS technologies in the civil …","Public administration and defence, compulsory social security"
"How viable is international arms control for military artificial intelligence? Three lessons from nuclear weapons","Many observers anticipate “arms races” between states seeking to deploy artificial intelligence (AI) in diverse military applications, some of which raise concerns on ethical and legal grounds, or from the perspective of strategic stability or accident risk. How viable are …","Public administration and defence, compulsory social security"
"[PDF][PDF] Possibilities and challenges for artificial intelligence in military applications","Recent developments in artificial intelligence (AI) have resulted in a breakthrough for many classical AI-applications, such as computer vision, natural language processing, robotics, and data mining. Therefore, there are many efforts to exploit these developments for military  …","Public administration and defence, compulsory social security"
"[PDF][PDF] Professor Evans PAVS 4500 9 December 2018 Artificial Intelligence in the United States Military: Exploring Lethal Autonomous Weapons","The days of waging and winning war by simply having the largest military are over. A military must be trained, highly skilled, and possess weapons that will undeniably overpower any adversary. Nations, especially China and the United States (US), have accordingly begun …","Public administration and defence, compulsory social security"
"Condition monitoring of engine lubrication oil of military vehicles: a machine learning approach","Lubrication oil plays an important role in maintaining the health and performance of a land vehicle engine. Accurate condition monitoring of lubrication oil enables an effective predictive maintenance regime to be established. This can extend engine life as well as …","Public administration and defence, compulsory social security"
"War data. Big data and algorithms used by the military","“Big data and algorithms” devices were integrated into the US military in the 2000s. In Afghanistan and Iraq, the armed forces used them to detect “insurgents” within the population and to predict new “insurrections.” These devices have been used to automate …","Public administration and defence, compulsory social security"
"Artificial Intelligence, Robotics, Ethics, and the Military: A Canadian Perspective.","Defense and security organizations depend upon science and technology to meet operational needs, predict and counter threats, and meet increasingly complex demands of modern warfare. Artificial intelligence and robotics could provide solutions to a wide range of …","Public administration and defence, compulsory social security"
"Research on the Optimization of Military Supplies under Big Data Background","On the basis of analyzing the characteristics of big data technology and combining the actual demand of military demand industry in our army, this paper constructs a comprehensive analysis environment of big data for military demand, and on this basis …","Public administration and defence, compulsory social security"
"Can Big Data Forecast North Korean Military Aggression?","Can textual analysis improve statistical prediction of risky geopolitical events? North Korea is the greatest source of geopolitical risk for South Korea due to the former's unpredictable and secretive military actions against the latter. We find that the tone of English language …","Public administration and defence, compulsory social security"
"Analysis of Military Academy Smart Campus Based on Big Data","This paper compares the digital campus with the smart campus and analysis the framework of smart campus in the big data environment, based on the actual characteristics of military academies. The framework utilizes the information technologies such as Internet of Things …","Public administration and defence, compulsory social security"
"Condition monitoring of engine lubrication oil of military vehicles: A machine learning approach","Lubrication oil plays an important role in maintaining the health and performance of a land vehicle engine. Accurate condition monitoring of lubrication oil enables an effective predictive maintenance regime to be established. This can extend engine life as well as …","Public administration and defence, compulsory social security"
"Facilitation of Trust in Automation: A Qualitative Study of Behaviour and Attitudes Towards Emerging Technology in Military Culture","The research in this field is limited due to the inherent technological limitations of existing systems, of which has saturated the literature at this point (Barnes, et al., 2014). The core of existing research centres along assessment of emerging and novel interfaces for the pursuit …","Public administration and defence, compulsory social security"
"Two Lessons from Nuclear Arms Control for the Responsible Governance of Military Artificial Intelligence","New technologies which offer potential strategic or military advantages to state principals can disrupt previously stable power distributions and global governance arrangements. Artificial intelligence is one such critical technology, with many anticipating 'arms races' …","Public administration and defence, compulsory social security"
"Investigation into maritime military platform hull defects automation of sensors and processing: Research-in-progress","Management of maritime military platform life is a real challenge for operators and maintainers. One of the major problems is how to capture cost effective information about the hull defect and predict the remaining life? This paper will focus on the automation process …","Public administration and defence, compulsory social security"
"Artificial Intelligence Within the Military Domain and Cyber Warfare","The potential uses of machine learning and artificial intelligence in the cyber security domain have had a recent surge of interest. Much of the research and discussions in this area primarily focuses on reactive uses of the technology such as enhancing capabilities in …","Public administration and defence, compulsory social security"
"Application of Big Data Technology in Scientific Research Data Management of Military Enterprises","Scientific research data has an important strategic position for the development of enterprises and countries, and is an important basis for management to conduct strategic research and decision-making. Compared with the Internet industry, big data technology …","Public administration and defence, compulsory social security"
"The Impact of a BIG DATA Decision Support Tool on Military Logistics: MEDICAL ANALYTICS MEETS THE MISSION.","Using big data and predictive analytics, more segments of the US military will be able to create decision support tools that help them not only to carry out their missions more efficiently, but also to streamline their logistical requirements. Within the military's medical …","Public administration and defence, compulsory social security"
"Machine learning techniques for autonomous agents in military simulations—Multum in parvo","In military simulations, software agents are used to represent individuals, weapon platforms or aggregates thereof. Modeling the behavioral capabilities and limitations of such agents may be time-consuming, requiring extensive interaction with subject matter experts and …","Public administration and defence, compulsory social security"
"Insights for the third offset: Addressing challenges of autonomy and artificial intelligence in military operations","CNA conducts analysis for the US Navy, the Department of Defense (DOD), and other sponsors, ranging across policy, strategy, organizational processes, technical performance of military systems, and current operations. Because of the expected impact of autonomy …","Public administration and defence, compulsory social security"
"Research on Military Logistics based on Big Data","This document gives formatting instructions for authors preparing papers for publication. With the arrival of the era of big data, the mature use of cloud computing and data mining technology, the big data mode have been widely applied in logistics. For military logistics, a …","Public administration and defence, compulsory social security"
"Modeling and Simulation for the Automation of Aerial Refueling of Military Transport Aircraft with the Probe-and-Drogue System","This paper presents the modeling and simulation activities currently conducted at DLR to support aerial refueling automation research activities. During the air-to-air refueling maneuver the tanker and receiver aircraft need to fly very close to each other, which induces …","Public administration and defence, compulsory social security"
"Discussion on Approaches and Method of Cultivation of Talents in Military Big Data","Military postgraduate education is an important propeller of the transformation of combat power generation model. It is the cornerstone of the army's innovation system and innovation ability. It is the main basis for the construction of the high-level military talent. It …","Public administration and defence, compulsory social security"
"Classification of Military Aircraft in Real-time Radar Systems based on Supervised Machine Learning with Labelled ADS-B Data","Air surveillance is usually based on real-time radar tracking systems, which are able to provide object positions, kinematics and a short time history. Due to the density of the air picture, air traffic controllers normally focus on the actual object kinematics and the full …","Public administration and defence, compulsory social security"
"[PDF][PDF] Developments in Artificial Intelligence–Opportunities and Challenges for Military Modeling and Simulation","One of the principal themes the NATO Science and Technology Organization (STO) is fostering in 2017 is"" Military Decision Making using the tools of Big Data and Artificial Intelligence (AI)"". Simulation might play a significant role to play in these developments as it …","Public administration and defence, compulsory social security"
"Using Artificial Intelligence to Minimize Information Overload and Cognitive Biases in Military Intelligence","Information overload and cognitive biases are two challenges analysts face in the quest to produce timely intelligence. In today's digital world, analysts have access to more information than their human brains can process. Analysts draw on their personal …","Public administration and defence, compulsory social security"
"Automation of Testing Military Avionics Mission Critical Software","Ahstract-This paper brings out the Test Automation framework for testing Mission Critical software of Mission Computer. The Mission Computer is a manager of the complete Avionics systems which include multiple sensors, weapon management, flight management system …","Public administration and defence, compulsory social security"
"Are We Flooding Pilots with Data?–Effects of Situational Awareness Automation Support Concepts on Decision-Making in Modern Military Air Operations","Within highly dynamic situations, the amount of relevant information that a pilot needs to process to make an informed decision can be substantial. With an ever increasing amount of data available to the pilot there is a real risk that not all relevant data can be taken into …","Public administration and defence, compulsory social security"
"WHEN SOMETHING HAS TO GIVE: The intersection of Artificial Intelligence, Military Decision-Making and International Humanitarian Law","This thesis explores the intersection of three disciplines: military normativity, international humanitarian law, and artificial intelligence, focusing specifically on intelligent systems that assist superiors in conducting the military decision-making process. It explains the extent to …","Public administration and defence, compulsory social security"
"Artificial intelligence, ethics and human values: the cases of military drones and companion robots","Can artificial intelligence (AI) be more ethical than human intelligence? Can it respect human values better than a human? This article examines some issues raised by the AI with respect to ethics. The utilitarian approach can be a solution, especially the one that uses …","Public administration and defence, compulsory social security"
"Research on the Cultivation Model for Civil-military Integrated Artificial Intelligence Technology Talents","Artificial intelligence is the strategic technology that leads the future, and it is also one of the fastest growing technologies today. The development of artificial intelligence technology has a great influence on the development of society, the standard of living of the people and …","Public administration and defence, compulsory social security"
"[CITATION][C] Battlefield Singularity: Artificial Intelligence, Military Revolution, and China's Future Military Power","[CITATION][C] Automation Kit for Dual-Mode Military Unmanned Ground Vehicle for Surveillance Missions","Public administration and defence, compulsory social security"
"The field of autonomous vehicles is an area of great importance nowadays among Intelligent Transport Systems. These autonomous vehicles must meet high standards of robustness, safety and protection to make autonomous driving safer than human driving, thus improving …","[CITATION][C] Autonomy in weapon systems: The military application of artificial intelligence as a litmus test for Germany's new foreign and security policy","Public administration and defence, compulsory social security"
"… UNICA IRIS Institutional Research Information System. IRIS è il sistema di gestione integrata
dei dati della ricerca (persone, progetti, pubblicazioni, attività) adottato dall'Università degli
Studi di Cagliari dal mese di luglio 2015. IRIS Univ. Cagliari; Catalogo Ricerca Università di …","[CITATION][C] The promise and peril of military applications of artificial intelligence","Public administration and defence, compulsory social security"
"[BOOK][B] Data Analytics: The Same Old Next Big Thing for Military OR?","… The sudden popularity of “big data” analytics and data science has fueled discussions between
applied … future motion of the moving target [...] Today such problems would be classified as artificialintelligence … this example is that not only some of the fathers of military OR were … 
","Public administration and defence, compulsory social security"
"[CITATION][C] Study on architecture of big data based on military intelligence analysis and service system","[CITATION][C] The Economic, Security and Military Implications of Artificial Intelligence for the Arab Gulf Countries","Public administration and defence, compulsory social security"
"[CITATION][C] Chinese Advances in Unmanned Systems and the Military Applications of Artificial Intelligence—The PLA's Trajectory Towards Unmanned,'Intelligentized' …","[CITATION][C] Artificial Intelligence and the Military","Public administration and defence, compulsory social security"
"[CITATION][C] Big Data and Artificial Intelligence for Military Decision Making","The Future of Military Automation and Manpower","Public administration and defence, compulsory social security"
"The rapid development in autonomous vehicles and artificial intelligence over the last decade has left most analysts and scholars convinced that the armed forces are facing a large scale change of technology, doctrine and organization. But few if any have addressed …","The Future of Military Automation and Manpower [video]","Public administration and defence, compulsory social security"
"The rapid development in autonomous vehicles and artificial intelligence over the last decade has left most analysts and scholars convinced that the armed forces are facing a large scale change of technology, doctrine and organization. But few if any have addressed …","[PDF][PDF] ARTIFICIAL INTELLIGENCE IN THE MILITARY: MORE THAN KILLER ROBOTS","Public administration and defence, compulsory social security"
