"Titles","Abstracts"
"[CITATION][C] Study on architecture of big data based on military intelligence analysis and service system","[CITATION][C] The Economic, Security and Military Implications of Artificial Intelligence for the Arab Gulf Countries"
"[CITATION][C] Chinese Advances in Unmanned Systems and the Military Applications of Artificial Intelligence—The PLA's Trajectory Towards Unmanned,'Intelligentized' …","[CITATION][C] Artificial Intelligence and the Military"
"[CITATION][C] Big Data and Artificial Intelligence for Military Decision Making","The Future of Military Automation and Manpower"
"The rapid development in autonomous vehicles and artificial intelligence over the last decade has left most analysts and scholars convinced that the armed forces are facing a large scale change of technology, doctrine and organization. But few if any have addressed …","The Future of Military Automation and Manpower [video]"
"The rapid development in autonomous vehicles and artificial intelligence over the last decade has left most analysts and scholars convinced that the armed forces are facing a large scale change of technology, doctrine and organization. But few if any have addressed …","[PDF][PDF] ARTIFICIAL INTELLIGENCE IN THE MILITARY: MORE THAN KILLER ROBOTS"
"“Artificial Intelligence (AI) is the future.[...] Whoever leads in AI will rule the world”(Russia Today, 2018). This was the central message that President Vladimir Putin conveyed to more than one million Russian school students in September 2017. He also promised to ensure …","Modelling of the Force Protection Process Automation in Military Engineering"
"Article deals with a set of problems linked to a Engineer Force Protection Provision algorithm design and evaluation of input factors series. This algorithm is generally compatible with The NATO Force Protection Process Model adjusting it to a part of engineer forces' decision …","Intrusion Detection of Data Platform Based on Extreme Learning Machine in Civil and Military Integration"
"… Based on big data, military and civilian integration ensures that the function of system information
system is to maximize the value of data through the data flow, convergence, analysis and
application so as to achieve the effect of accurate and effective protection … 
",NA
